{
  "$schema": "../schemas/approval-record.schema.json",
  "schema_version": "1.0.0",
  "record_id": "APPROVAL-TEMPLATE",
  "product_sku": "REPLACE-WITH-SKU",
  "risk_level": "B",
  "release_tag": "v0.1.0",
  "candidate_commit_sha": "REPLACE_WITH_EXACT_40_CHARACTER_CANDIDATE_COMMIT",
  "candidate_deployment_url": "https://replace-with-reviewed-staged-origin.example",
  "artifact_hashes": {
    "dist/replace-with-artifact-name.zip": "REPLACE_WITH_EXACT_64_CHARACTER_SHA256"
  },
  "decision": "PENDING",
  "conditions": [],
  "reviewers": [
    {
      "name": "Replace with product owner name",
      "role": "OWNER",
      "decision": "PENDING",
      "reviewed_at": null
    },
    {
      "name": "Replace with competent reviewer name",
      "role": "COMMERCIAL_REVIEWER",
      "decision": "PENDING",
      "reviewed_at": null
    }
  ],
  "reviewed_at": null,
  "evidence": [
    "Replace with repository-relative paths to the final review pack and validation evidence"
  ],
  "notes": "TEMPLATE ONLY. Copy to a release-specific filename, replace every placeholder and attest the reviewed candidate commit, deployment and artifacts."
}
